{
  "$schema": "https://json-schema.org/draft/2020-12/schema",
  "title": "SKU Brief",
  "type": "object",
  "required": ["sku_id", "products", "region", "audience", "attributes"],
  "properties": {
    "sku_id": { "type": "string", "maxLength": 64 },
    "products": {
      "type": "array",
      "minItems": 2,
      "items": {
        "type": "object",
        "required": ["name", "description"],
        "properties": {
          "name": { "type": "string", "maxLength": 100 },
          "flavor": { "type": "string", "maxLength": 100 },
          "description": { "type": "string", "maxLength": 500 }
        }
      }
    },
    "brand_name": { "type": "string", "maxLength": 100 },
    "packaging_type": { "type": "string", "maxLength": 100 },
    "cultural_context": { "type": "string", "maxLength": 500 },
    "region": { "type": "string", "maxLength": 64 },
    "audience": { "type": "string", "maxLength": 200 },
    "attributes": { "type": "array", "items": { "type": "string", "maxLength": 50 } }
  }
}
